clippings,url,victim
"would not accept it under thatcondition . it is , therefore , doubtful whetherhe will accept the present pardon on thesame condition.justice byler does not like to be pesteredwith litigants who are dissatisfied with hisdecisions , and saturday made an exampleif one . a man named g < go sued george taylor , a soda-water manufacturer , fordamages , alleged to have been done to hisproperty while taylor was a tenant , andsecured a judgment of 189 in justice byler 's art . taylor appealed the case andthe superior court gave , a judgment for £gonly . this convinced taylor that justicebyler had been biased , and when hornethim on the street saturday lie commencedto make remarks that irritated hit * justice ! the latter then went before recorderi'ziay and swore to % complaint , chargingtaylor with disturbing his peace . taylorwas tried and found guilty nnd will appearfor sentence this morning",https://chroniclingamerica.loc.gov/lccn/sn94052989/1892-01-18/ed-1/seq-7/ocr/,george taylor
"town , as it is said by some thatthe man made an effort to kick off therock into a crowd of ladies and children .the sheriff and solicitor proctorwent up on the next rain and tried tocatch the man at stevenson but failed.the wounded young man is a son of james davis , and is one of the mostpopular young men in the county.miss willie tally , the 16-year-olddaughter of col. and mrs. williamtally of bass , died yesterday . shewas one of the beautiful young girlsof this county . she had been ill onlya few days . her father . colonel tally , is the largest tax payer in the county.she is a niece of hon . john b. tally ofscottsboro.tolbert kennedy and miss willieaustin were married in chattanoogayesterday , without notice or consentof the parents of either of the young jcouple.the bridegroom is a son of thomas |kennedy , editor",https://chroniclingamerica.loc.gov/lccn/sn84020645/1907-06-02/ed-1/seq-16/ocr/,james davis
"flmf ts : is as fine us retails t.rt '' j more than our price . our price . y'.m elkhart carriage and harness manufacturingend of bad negro.fiend who killed two girlsis successfullylynched.mob of 1,500 paeticipates , taken from his captors andquickly disposedof.rueblo , colo .. may - ' 3 calvin kimblern , the uero who shot andkilled two young girls and seriouslywounded his wife early sunday moruing , was lynched here early thismorning by an angry mob of 1,600.kimblera was captured yesterday indeltdr , and brought here last nijjht.l on the arrival of the train the mobof de.ermined citizens surrounded it , verpowered the ollicers , took thenegro from the train , put a ropearound his neck and dragged himsome blocks , when the rope wasquickly put across a telegraph poleand the negro strung up . the rcpebroke twice . the third attempt wassuccessful . the crowd dispersed inan orderly manner.the",https://chroniclingamerica.loc.gov/lccn/sn92053934/1900-05-23/ed-1/seq-3/ocr/,calvin kimblern
"on trial for tho murder of john ltyan , wns convicted ol noon to-day of manslaughter in tho urst degree , m itlio convicted dynamiters.london , may 21. the convicted dynamiters , cunningham and hurton , wero removed rrom newgate to chatham prbonthis afternoon.cooper to hang.dai.timoiu : , may 21. howard cooper was this morning sentenced bv judgostewart to be hung.tlio kaiser itnllor.hr.in.in , mny 21 , the emperor isbetter . .friday 's contests.lvntiies for the capital llleyclu club'suncus , the entries for tlio annual races or thecapitol uieyclc club , which take placeat athletic park to-morrow afternoon , closed at 12 o'clock to-day . the followingore tlio entries : ono mile tor novices f. m. phillip , 11.il.stincmctz , jay a. kcniilcott , t. e.morgan and t. j. johnson , ono mile , 1 ) , 0. championship wm.tl.crist , l. m. kruger , 11. w. ilaiina . p. l.scullbrlc and",https://chroniclingamerica.loc.gov/lccn/sn82000205/1885-05-21/ed-1/seq-1/ocr/,howard cooper
"thieves were lynched fridaynight at lookout , modoc co .. calif. , a district which has always been noted for quiet and good order . thelynching was done by fifty small stockraisers , but none of the vigilantes wasidentified by the constables and hisone assistant , whom they overpowered . calvin hall , aged 72 , his threehalf-bred sons , frank , aged 2t ; jim.aged 19 , and martin , aged 16 , anddan yantis , aged 27. were the victime . the charge against halls ' sonsand yantis was burglary , whileagainst hall it was petty larceny.many small articles had been missedrecently , among others hay forks , barbwire and harness . these were foundin hall 's house , along with halters , dishes and table cloths . all five werearrested and taken to adin , the county seat of modoc county , and placed incharge of the constable and",https://chroniclingamerica.loc.gov/lccn/sn87056251/1901-06-07/ed-1/seq-2/ocr/,calvin hall
"others , rev . a. e. horton , col . henry a. thomas , postmaster ofboston : chief george s. evans , in chargeof the new england post office inspectors ’ office , all of whom spoke.whiteway ministry resigns.st . johns , n. f. , november 16.—theministry headed by sir william white way formally resigned office this evening . before resigning sir william wishedto fill all vacancies in the civil servicewith his defeated supporters and theirfollowers , but sir herbert murray , governor of newfoundland , refused to sanctionany permanent appointments and consented to authorize only acting appointees.did murder in a church.new york , november 16.—the jury inthe ease of fritz meyer , accused ol themurder of policeman frederick smith inthe church of the most holy redeemer , brought in a verdict of murder in thefirst degree today . meyer was foundguilty after only f6 minutes ’ deliberation.the food fair.the attendance at",https://chroniclingamerica.loc.gov/lccn/sn83016025/1897-11-17/ed-1/seq-2/ocr/,william white
"several otherpersons.cost of the trouble.a complete list of the casualtiessince the trouble began follows : killed : john t. day , white , police captain ; peter j. lamb , white , policeman ; august thomas , negro , laborer ; baptiste fllean , negro , aged 75 years ; lewis taylor , negro , laborer ; gabrielporteus , white , sergeant of police ; joseph lally , white , corporal of police ; a. van kurem , white , keeper of cityworkhouse ; alfred j. brumfield , white ; robert charles , negro , author of the trouble ; anna mabry , negro woman , killed in her home bymob ; unknown negro , companion olcharles . wounded : esther fields , negro ; oswald mcmahon , white ; frank.shepherd , white ; alex . ruffin , negro ; joseph deeds , white ; ( 1. f. davis , white ;",https://chroniclingamerica.loc.gov/lccn/sn87057928/1900-08-02/ed-1/seq-6/ocr/,lewis taylor
"with a littie dinner at an uptown restaurant last evening.now the members of the club are pattingeach other on the back , and congratulatingthemseives on the satisfactory outcome ofthe late unpleasantness.tired of marriage.two applications for divorce filedtoday.for maggie a. collins , attorney h. t.wiewall today filed a petition for divorcefrom william collins . the parties weremarried here april 8 , 1890 , and have twochildren , a girl of four years and a boy often months . for two or three years , saysmrs . coilins , her husband was pleasant andagreeable , but becomi-.g , she asserts , addicted to strong drink , she claims that hehas since then cruelly abused her and bashabitually applied to her `` every vile , profane and indecent epithet to be found in adrinkard 's vocabu~lary . '' stating that sheowns > two houses , and that her husboandspends his earnings in riotous living anddic",https://chroniclingamerica.loc.gov/lccn/sn83045462/1895-11-06/ed-1/seq-12/ocr/,william collins
"end of atiresome journey would rather be greeted attheir favorite hostelry by a low-voioed , pretty woman than tho studied indifferenceand calm impertinence which appear to betho most sedulously cherished gifts of thehotel clerk of to-day.the trenton ( n . j . ) gazette , mentionsthe case of sir . john woods with the amer­ican pottery co. , thit city , who was curedby st. jacobs oil of an attack of rheu­matism , which had confined him to his bedfor seventeen weeks , lie praises it un­stintedly.thomuj ii . e lison . the inventor , sugkosts that eleclnc lights be placed underthe water from the battery to sandy hook , new york harbor , so as to define thechannel the darkest night.this from the cleveland 1 ohio ) ptnwjpress , carries its own suggestion : re­cently meeting mr. h. g. keller , treasurerof the c ! cethin ! hcrahl , our representa­tive",https://chroniclingamerica.loc.gov/lccn/sn85042404/1882-01-06/ed-1/seq-3/ocr/,john woods
"within nine months from atomdate . william mcgowan , admlnlsi.-.xtoithe account of the subscriberguardian of angus t. kennedy . henry ckennedy aud d < -n « ld f. kennedy , minor * , wd : be settled by the hudson county orphan * 1court on april 3 , 1908 , henry thomas the final account of the iub.serlber . administrator of gottlieb bdasing , deceast-c , will be settled by the hudson countyorphans ' court on june 6 , 1903.henry rollfs.the~'ccount~of~the ' subscriber|surviving executor of abraham o. znb.tskle , deceased , who was the surviving trustee under the wtjh of john tonnele , deceased , will besettled by the hudson county orphan- ’ c < -ur * on june 13 . 1903. augustus zabriskis . xml|txt",https://chroniclingamerica.loc.gov/lccn/sn87068097/1903-05-12/ed-1/seq-2/ocr/,henry thomas
"states during the weekended on the 3d , against 207 the sameweek in 1901.the exchanges at the leading clearing houses in the united states during the seven days ended on the 3daggregated $ 2,715,319,810 . the increase , compared with the corresponding week of last year , was 26.7.fred and charles johnson , 28 and21 years respectively , and sons of oneof the best known residents of woodville , ind. , were asphyxiated by gas.seventy-three schools in chicagodepending on furnace heat will beclosed december 1 unless the coalstrike ends.weekly reviews of trade reportcontinued satisfactory conditions andbright outlook , particularly in thewest.burglars took si , ooo from the safeof the bank at norman , neb.the cut of the saw mills in minneapolis shows a shortage of nearly 100 , -000.000 feet over the log cut last year.andrew freedman , of new york , hasretired from the national baseballleague control. ‘ fire at toolumne",https://chroniclingamerica.loc.gov/lccn/sn85033295/1902-10-11/ed-1/seq-2/ocr/,charles johnson
"`` washington 's headquarters while . surveyingthe city of washington '' were locatedin a tiny whitewashed house wherea painter 's sign hangs out of the second story window and a plumber'sestablishment is on the first floor.these people do n't see the beautiful place . `` the oaks . '' where john calhoun lived while a member ofconcress , or the wide view from theprettily parked reservoir . theyhave n't time to wander dewn charming lovers ' lane where rock creekmeanders by . or sit in st- john'schurch , georgetown , where georgewashington . thomas jefferson andother highly respectable citizens ofthe old days used to drowse throughthe sermons.but the war of today has calledgeorgetown to the front . her sonsare `` over there '' and her daughtersare working for the government . thespacious rooms of the old homes arefilled by that prosaic species of humanity the boarders.one killed , 61 injuredin philadelphia riotphiladelphia",https://chroniclingamerica.loc.gov/lccn/sn88084272/1918-07-29/ed-1/seq-10/ocr/,john calhoun
"kopp adr mary c. kopp.benjamin leach adr jacob maupin.wesley massie adr mary s. ilenson.wesley massie adr ursula philipp.henry sanders adr christian sanders . third day , wednesday nov. lth.henry bonner curator william iseman . margare th diebold g & c mh wen-deiin diebold.jackson smith g & c m h mary smith williams wehmeyer g c ii . & s.stock.kasten buschmann executor casperii . bueggesickkasten buschmann executor georgemittendorf.kasten buschmann adr john streckkasten buschmann admrgeorgeklinge.mathilda boos admx john booskasten buschmann et a fred nol-tensmeyer.mary helmers admx a. d. heini ers.hermann kopp adr d b n c t agottfried kopp.l . m. mahanay adr j. d. eoberts.wesley massie adr louisa finken.jacob michel jr. adr jacob micheler.wesley massie adr simon winter.ilelenlv ochsner ex henry ochsnerchrist oelschlaeger cxr daniel oelsehlaeger . fourth day , thursday , nov. löth.henry iiead exr william jose.henry pvead adr t. w. smith.valentin streck surv pari valentin & john streck.elisabeth sommerfeld ex williamsommerfeld.anna",https://chroniclingamerica.loc.gov/lccn/sn93060116/1877-11-08/ed-1/seq-1/ocr/,smith williams
"employes of the santafe general offices are spending christmas out 01 tne city : ijavia a. bibleratchison ; & stoddard , kansas city ; william elder , lawrence ; vy . o. shreves.ottawa : i c. wiisod , kansas city ; g. r , anderson and wife , olathe ; john hayes , kansas city ; c. bunning and wife , leavenworth : w. c ilellar , ivansaa city : t. y. horton , lawrence ; john weaver , kansas cityrain up at omaha.omaha . net. , dec. 25. the missouririver at omaha rose eight inches yesterday . this is quite unusual since ' norains have occurred in this locality.river men do not expect it to gohigher , -wwe will sell all we haveleft of toys games andfancy china for one weekat exactly half our former price . this is ofcourse less than we paidfor them and quite a lossto us ,",https://chroniclingamerica.loc.gov/lccn/sn82016014/1895-12-25/ed-1/seq-5/ocr/,john hayes
". the florist , oflafayette street , fell on the ice whileat work at the greenhouses ' on montreal street , wednesday evening , andbroke his left wrist in two places.knocked down.poiiceman johnson assatted bytoughs on oxford street.had told them to move onwhen one of gang made savageattach on him.policeman richard johnson was setupon by a gang of toughs on washington avenue , near the corner of oxford street , at 10.30 thursday evening.he was knocked insensibie but quickly recovered and afterwards went tohis home.the officer was patroiiing his beatand as he was waiking over washington avenue he met a number ofyoung feiiows who were hanging upnear oxford street . they had beendrinking and were making ioud taik.poiiceman johnson asked them to moveon and to stop their noise . ko soonerhad he uttered his warning when oneof the biggest men in the gang , a powerful chap , approached him and withone",https://chroniclingamerica.loc.gov/lccn/sn83016025/1904-03-11/ed-1/seq-3/ocr/,richard johnson
", ltd. , o vs. i no . ir » r > ( ! salt watkr lumher co. , ltd.19th .ludicinl district court , pariah ofiberia , state of louisiana.notice is hereby given that by viitue ofa writ of fieri facias issued out of theabove entitled matter , i , george henderson , sheriff , through w. l. dupuy , deputy sheriff , have seized and will offer forsale and will sell to the last and highestbidder for ( 'ash , at the court-house inthe city of new iberia , slate of louisianabetween legal sale hours , on saturday , march : id , 1 ! ) 0ti , the following described propeity to-wjt : a certain tract of land situated at . 'liepiquant near patoutville , iberia panshmeasuring four hundred aud seventeenand one third ( 417- j > 3 ) feet running eastand west by fourteen hundred and sixtyand two thirdsEND CLIPPING | START CLIPPINGof one hundred and thirtynine and 55-100 dollars with legal interest from april 12th , a. d. 1905 , and costsof protest fees , and also the smn of $ 12.50clerk costs , and all costs of these proceedlntfs.o ( liven officially this 27th day of januarya . d. 1900. george henderson , sheriff , per w. i j . dupuy , deputy sheriff.offers the best and quickestservice andspecial round tripratesto allconventionsin thesoutheast and east.for information relative to rates , schedules , etc. , kindly address , holmes smith , traveling pass . agt.houston . tox.illinois centralwchicagolouisvillest . louiscincinnatiaid all polats north and east.up-to'date throughtrains.sn that your tlckit reads via til line.for full information , apply fo ticketagents or addr < » asn . d pinch , t. p. a. , houston , te « a « , rub miuci < * no « nttrd paru , tmv * ttivm in wateron",https://chroniclingamerica.loc.gov/lccn/sn88064328/1906-01-27/ed-1/seq-5/ocr/,george henderson
"ko » e . ' rtf'rvnt-i : — mnana hr.rnt bioomlng on ; l. liua| hertson , mt . hope : s , s. l ! rs < ney . patch grove ; j m ! ®'fkt-fls .. ii . latch grove ; j. v. douahee , jstue-towu ; ' john kemp . jamoatnivi ] 4bm4to the farmers ” of grant county : th * gran idee , ieretmn of a ainibie , ch » apand durableportable fencehaa finally wen invented and now anccesaful us * hythe inveiitor . mr p. ter n , thornton , and a * • by mr.jam , - mil ■ r , one id trie largest .tuck growers in thewestern part , | ur # t coiitity.thradtsuti.ee * us the * lk.v * tn-ntiev ed sec - * t > yt'the common poet .-md board ledce ur •i iu rt ' s * “ * lrfo",https://chroniclingamerica.loc.gov/lccn/sn85033133/1868-04-28/ed-1/seq-4/ocr/,john kemp
"danclne '' andvrhat ib `` ahawef tfl , -dancing '' mightb helpful . , i . 'the pretence of much ta & kolnx tilthe st lottto volirfophwtl , ilfvtnerted . ye . but '' 'th'rj wfe ; ? rio '' too muca lociaium in tne curxpcjr measure to please `` jim hill .itso tench dryanlsm in it to pleasenburnebraska `` democratic , senator.not at all neoemry.still , to our mind it is hardlynecessary for tho governor ot thogroat state of nebraska to worto sidoby sido with convicts to prove hisdevotion to tho cause of good roads.at any rate , it does not striko us ascalculated to add anything , to thedignity of what is supposed to bo anozalted office conferred by tho suffrages of tho poo pie.tjxbj ) ay in omaha1comfiup ihdm see nitsinto the discard.crash ! the old ' roller towel , which , like `` my grandfather'sclock , '' hung",https://chroniclingamerica.loc.gov/lccn/sn99021999/1913-10-11/ed-1/seq-12/ocr/,jim hill
"don g. russell,422 ninth st. , huntington , w.va.foley9s kidney curemakes kidneys and bladder right.advertiser , \ds pay.do you advertise in the advertiser ' : if not , more than half the people ofhuntington and vicinity do not knowof your existence.negro fiend burned atthe stake in leavenwortha kansas mob takes fred alexander from sheriffs posseand deals out speedy justice-state troopswere refused by governor.leavenworth , kan , -ian , 16— fred alexander , was taken from the sheriff'sguard and burned at a stake at thescene of ljis crime , not a half dozenblocks from the center of the city lastevening . fred alexander was arrested for attempting to assault miss eva roth saturday night last , and he was chargedwith the assault and murder of pearlforbes , the a-sault and murder ofpearl forbes occurred november 6th , last . miss forbes w-ho was twentyyears of age , was employed in a candyfactory .END CLIPPING | START CLIPPINGadvertise in the advertiser ' : if not , more than half the people ofhuntington and vicinity do not knowof your existence.negro fiend burned atthe stake in leavenwortha kansas mob takes fred alexander from sheriffs posseand deals out speedy justice-state troopswere refused by governor.leavenworth , kan , -ian , 16— fred alexander , was taken from the sheriff'sguard and burned at a stake at thescene of ljis crime , not a half dozenblocks from the center of the city lastevening . fred alexander was arrested for attempting to assault miss eva roth saturday night last , and he was chargedwith the assault and murder of pearlforbes , the a-sault and murder ofpearl forbes occurred november 6th , last . miss forbes w-ho was twentyyears of age , was employed in a candyfactory . she started from work at 6o'clock , walking , as was her custom.she failed to reach home that nightandEND CLIPPING | START CLIPPINGfred alexander from sheriffs posseand deals out speedy justice-state troopswere refused by governor.leavenworth , kan , -ian , 16— fred alexander , was taken from the sheriff'sguard and burned at a stake at thescene of ljis crime , not a half dozenblocks from the center of the city lastevening . fred alexander was arrested for attempting to assault miss eva roth saturday night last , and he was chargedwith the assault and murder of pearlforbes , the a-sault and murder ofpearl forbes occurred november 6th , last . miss forbes w-ho was twentyyears of age , was employed in a candyfactory . she started from work at 6o'clock , walking , as was her custom.she failed to reach home that nightand her body was found in the ravinenear her home on the following morning . marks on her throat indicatedthat she had been murdered by strangulation , and the surroundings gaveevidence of",https://chroniclingamerica.loc.gov/lccn/sn85059809/1901-01-16/ed-1/seq-1/ocr/,fred alexander
publishedin the poiit yesterday tt wns made to appearthat uuirlcs harris who was given habeasacorpuh hinrlng in tho criminal district courtwednesday was charged with tho murderof mai toole this was erroneous harriswni cltrged with murder but it u on u < count of bis alleged complicity in the lynching of henry jefferson colored nt hlrschswood yard several weeks ngo the post slurormatlon regarding the case came directbut was sivin erionrouslykdwln hill whoso residence is 181c travisstreet received a telegraphic mesfcigejvednesduy afternoon haslenlug him to thobedside of his 8yrnrold daughter oladyswho with tho other mombers of the familywas visiting mr hills father nt waverlymr hill found his daughter in thu lasttinges of cnngcttlon nnd tho continued togrow worse until 12 to oclock thursday morning when she died tho remains ot thullttlo girl wore burled nt willis at 5 ocloiyesterday evening the family will bo ubsentfrom tho city for two weekslxsitsoxai mnvrio > mls,https://chroniclingamerica.loc.gov/lccn/sn86071197/1900-08-17/ed-1/seq-8/ocr/,henry jefferson
"heart of thocity . the . bodies , as they lay outstretched with faces heavenward , weremute reminders of the terriblework of seventy-five masked menin this city ut 3 o'clock this morning . the names of the negroes , whosebodies w ere literally shot to pieces bythis mob , were calvin mcdowell , william stuart and theodore .moss . theircrime was the ambushing and shootingdown saturday night last of four deputy sheriffs in a bad negro localityknown us `` the curve , '' while the officers were fulfilling their duty by looking for a negro for whose arrest theyhad a warrant . none of the ollicerswere killed.about 3 o'clock this morning seventyfive men , nil wearing black masks , appeared suddenly , on front street nearthe jail . the leader gained admittance by claiming that lie wus a deputy , slierilt ' and had a prisoner . onceinside lie was followed by",https://chroniclingamerica.loc.gov/lccn/sn85030821/1892-03-18/ed-1/seq-6/ocr/,calvin mcdowell
"; '' .. '' . '' '' '' '' * '' '' * - '' * * * . v1 s-april 2. l. m. thomas , juror - ....................... * xxmay 8 , geo . thompson , witness '. `` '' `` y-yyyy'—yy '. ? v '' .may 8 , john harris , juror ... : • : • , '' ••••.••.•.•.•• ; . '' • ; ••.• , ... • . „ .j , j^.may 8 , l. f. barcello , juror yyyy . ' '' '' '' * ••••'•••• , xx'may 8. a. c. la rose , juror . : .. yyyyyyyyy `` . ' '' '' ' '' `` 300'may 8 , peter j. esch , juror • '' .■. '' . : : : : : : : : : : : ! : '' . ; '' * * - ' 3 00■may 8 , sam neumann",https://chroniclingamerica.loc.gov/lccn/sn90059522/1895-04-29/ed-1/seq-13/ocr/,john harris
duncanbradford mr hubert charles burtonmr milton bennion mr john hardycoombs mr mervin wesley davis mrhenry erlandson mr carl ephraimgaufin mr daniel fenton hardingmr david lorenzo mcdonald mrcharles randall mabey mr david anelson mr william n petterson mrjoseph edward smith mr edwinspencer sheets mr ernest james taylor seth mr thomas walter robert wilson mri amusements ir 1at the theatrea bright andclever vaudeville show full of varietyand originality is the hopkins transoceanic company which appeared at thetheatre before a good audieniw last even iiing the bls feature is the rossow midgets two wee mites of men before whosecleverness and comicality tom thumb iand the other lilliputs who have appeared here are as nothing theirstrength is quite remarkable consideringtheir size and their boxing bout wasspecially ludicrous the audience broughtthem out again and again the show hasmany other bright features those mostispecially good being the musical act of isharp and flat and the dummy specialtyof the,https://chroniclingamerica.loc.gov/lccn/sn85058130/1896-06-09/ed-1/seq-8/ocr/,robert wilson
