clippings,url,victim
"colored , was fined $ 1 . robertrainier , colored , arrested by officer wilkersou , charged -with carrying a razor , was sent to the chain gang forninety days.sallle carter , colored , arrested by ofriccryoung , charged with disorderly conducttoward corntaylnr . colored , was dismissed.malildi jones , george jones and jamesanderson , all colored , charged with disorderly couduct . were dismissed.the family of mr. c. e. mlnitrec havegone to jacksonville , fla , to join mr.mlnltree , who was recently appointedgeneral agent of tbe southern railwayin that city.superintendent kemper yesterday finished the examinations of tbe public schoolteachers.a number of alexandrians are expectedto attend the excursion of almas'templeofwashlugtoa to marshall hall on august18.ntrtlen passed the lie.bitter 'words to chairman skinnerin popallht convention.ralegh , a . ... aug. 14.-the populiststate 'convention cssenioled ot 9 o'clockthis nioruing and was 111 session littleover an hour.u here wu a grea.t dispute at last",https://chroniclingamerica.loc.gov/lccn/sn84024442/1896-08-15/ed-1/seq-2/ocr/,george jones
", sa.a9v '' a.a.liud , short atara . s3.2s . a ei'abaittvu . aaaraaa . wraratlaarvaat arada oa tb iaaa . aaa t. ataaa vaalal i. tr . . itvrlla for 'm r.t. ; . ioooda . addnam . .sears , roebuck co.ffne.f chlcaaa.it reminds as of that nioneer luetic george humphreys whose regular fee forperforming the ceremony wa a backetof blackberries . friend matting , nodoubt , has visions of high life , berriessod cream , plucked from tbe bnih andpailed irom tb cow by the flowers ofyoutnana peauty when ble matrimonialbureau get ia motion , and a brothermalting understands tb value of advertising be will oon have tb field and '' be monarch of all b survey '' in tbeknot tying business . finch ' randomshot in the herald . the purchasing ofa house and lot in tbe 3rd ward by thherald reporter and tbe manner inwhich it ia being",https://chroniclingamerica.loc.gov/lccn/sn84022644/1899-10-27/ed-1/seq-4/ocr/,george humphreys
"? , george greer . richard h. hunt . henry jarrett.rowland l. kraus . charles w. rodman , jr. , w. g.rockefeller , winthrop rutherford . singleton vanschaick . william b. emery . l. j. knowles , danielbuckley and frank h. croker.the seaside house was sold this week by messrs. charles evans & son to george upplncott andwilliam h. bartlett for j550.000 . this is at therate of about 14.000 a front foot , which was therecord set by the recent sale of the motel st.charles . the messrs. evans will continue to conduct the seaside house until november 1. whenit will pass to its new owners arid `` governor '' evans will retire to private life . this rest ha.ibeen earned by a '.ontlnuous service in the hotelbusiness in atlantic city for thirty-six years . thisreal estate transaction tells the story of atlanticcity 's progress as ' a pleasure resort within",https://chroniclingamerica.loc.gov/lccn/sn83030214/1903-03-22/ed-1/seq-6/ocr/,charles evans
"missle missed itsmark , hitting and killing a child who wasstanding near.oov . merriam has issued his warrant tothe sheriff of redwood county , minn. , for theexecution of william rose , under sentence tobe hanged for the murder of moms lufkin , fixing date on friday , april 11. brown washington , the negro who was arrested for criminally assaulting and murdering a little nine-year-old niece of alfred horton , near madison , ga. , confessed his crimewhen taken before the coronor 's jury . afterhis return to jail he was taken by a mob andbanged to a telegraph pole , his body beingriddled by bullets.constable skinner , a des moines iowasearcher , shot `` dude '' henderson , a negrotough . the officer hud searched henderson 's place for liquor , and the latter resisted.the result was that henderson was badlybruised , and in a few hours started after theofficer",https://chroniclingamerica.loc.gov/lccn/sn84024779/1890-03-13/ed-1/seq-4/ocr/,brown washington
", proprietor of the arkansasdemocrat , and postmaster of thatcity , is a visitor in the city . weacknowledge a pleasant call thismorning . he is an old person ; 1triend , and we are glad to see himin fine health.yesterday at new lewisville , john spofford was killed by john crocker , crocker receiving twowounds in the neck , from a pistol inthe hands of spofford , before hekilled him . the fuss grew out ofspofford running against crockertwice in a surly manner.there are several business movesto be made in the business circles ofour city on the ist of january.some of our east side merchantsare going to the texas side , whilethere is a probability of fixing theplaces made vacant by them , byother merchants coming in.the blue degree of masons of thiscity , and order of railway conductors , buried conductor hunter yesterday , who died at the cosmopolitan hotel",https://chroniclingamerica.loc.gov/lccn/sn86090500/1895-12-30/ed-1/seq-3/ocr/,john crocker
"june . mrs. a.b . powers , of the colonial , will leave injune for charleston , to spend a monthwith her brother , mr. clarence bunker , u . s. a. mrs. e. h. bailey , of hollyavenue , returned from the eastwednesday . mrs. gardner moore andmrs . john morrison will go to baldeagle lake the first part of june . mrs.mudge . of laurel avenue , has returnedfrom osceola . mr. and mrs. wildermerriam , of summit avenue , are goingto wisconsin on a fishing trip thisweek . miss gordon has been spendinga few days with mrs. severance atcedarhurst.mrs . s. m. hayes , of nina avenue , will entertain saturday night in honorof miss charlotte mead and mr. e. r.sanford jr. , who will be married tuesday week at the house of hope . afterthe ceremony mrs. e. r. stanford , mother of the groom , will give",https://chroniclingamerica.loc.gov/lccn/sn90059523/1904-05-22/ed-1/seq-18/ocr/,john morrison
"winter will bo here , andcall at appel & schaul aud be remunerated.at katiu's.savannah daily morning news , “ the mynn ’ s mystery , ” by george manville feim ; “ helen buileroff , or a strangeduel , ” by martha morton ; “ prince fortunatus , ” by william black ; “ the sign of thefour , ” by a. conan doyle ; harper ’ * magazine for february , lippinoott ’ s magazinefor february , the nation . florida times-union ( trade edition for 1890 ) , newyork herald , world , sun , star , press , times , tribune , boston herald , bostonglobe , baltimore suu , cincinnati enquirer , cincinnati gazette , philadelphia press , philadelphia time * , new orleans timos-damocrat , atlanta constitution , maoontelegraph , augusta chronicle , charles ; , onnews and courier , charleston world , florida times-union , louisville",https://chroniclingamerica.loc.gov/lccn/sn86063034/1890-01-25/ed-1/seq-3/ocr/,william black
"to believethat under the surface there is intenseactivity . while there is little senseand less policy in the rabid japanesewar talk indulged in in some quarters , there is still every reason that americans should b # on the alert if they donot wish to lose the fruits won by john hays in the far east.latin american sensitiveness.another diplomatic situation onlyless acute than that of the orient concerns the latin american republics.this , too , is commercial , but in nonethe less vital because of ; hat fact.the two fields in which americantrade has the largest opportunities arecentral and south america and theorient . through the masterly diplomacy of blaine . hay and root theamerican situation in both fields wasimmeasurably improved . now thereis general talk that we are losingground both in south america and thefar east . it is hard to tell just whereall this talk comes from or what isthe",https://chroniclingamerica.loc.gov/lccn/sn87068192/1910-03-17/ed-1/seq-2/ocr/,john hays
"laws of our great commonwealth , but a few of this soldier'ssoldier friends took the law intotheir own hands and actuallyynched tho citizen , a la negrorapist fashion . xow if these samearmed conservators of tho peacecommit such a crime , from whatsource can law-abiding citizensexpect protection.wants a compromise . george davis , of tho 0th , is occasioifallv writinar a letter to thememphis papers , offering a treatyof peace with tho united btates.in his last letter ho claims tliatthe oflicors who went to arresthim the time garner was killedand marshall drown wounded , were drunk . this brown denies , but admits that his party hadlinuor aloiur with them . this is ashameful state of affairs that officers who are out for the purposeof suppressing the manufacture ofliquor should load up wuu it , eventhough it were all carried in dotties or jugs.cleveland 's message.in his nios8rgo to congress , president",https://chroniclingamerica.loc.gov/lccn/sn89058248/1893-08-17/ed-1/seq-2/ocr/,george davis
": 79aar . & 4—dreng lewis johu as byev , 6 aar . ' 6 -- arbejder curl christian as mond'jou , dod pan hospitalet , 40 aar.7 baunv melrin juren as jealousy dodpaa hospitalet , 13 aar . |c > barn hethelinda smith as byen , 5 midr.8 —arbejder charles wilson as st. georgu'sdvl pa hospitnlet , e : 40 aav.19 —darn marq fileming ui bethlehem dodpin hospitalet , 13 aur.11—arbejderske cathrine svanston as mct.piensant dod piu hospitalet , 21 aåar.12—snedker louis javes as breu , 3 ) aar , + 2 fattigpens . sarah bruce as byen , 65aur.13—guldsmed reginald sigismund towersa l ) ) _…'ll_ 62 8710 n.17 —baru alexamder ballentyne as prosperity dol pan hospitalet , + v85 arbepler honfy petrus as goidengrove , dod pin hospitalet c ; 15 aut1 & puke rjnlin pollidøre as byen , € ; ( 1aar.4 …— syende polet rodvers as byeu",https://chroniclingamerica.loc.gov/lccn/sn84037526/1911-10-07/ed-1/seq-1/ocr/,charles wilson
"with the taxes and penalty charged thereon , agreeably to law , are contained and described in the following : 1i_ ... owners ’ name.§3 & otownship 3 n , range l w.h k smith , el sw.township 4 n , range 1 w.john gatling , sw.same el se .. annie walker and others , el sw.l koch , nw se.wm . cook , nw.wm . manning , se.same nw.a u manning , sw. .unknown , ne . .. unknown , nw.john f krauter , ne ne.a t poulter , el sw.n i poulter , se.geo engler , ne sw.same se sw ... g c smith , sw sw .. wm fisher , se.g c smith , ne sw ... .same wi se.same se se.same ne ne.wm fisher , nrr el.township 4 n , range 1 e.9 80 200 5 73 ; 5 160 240 7 356 80 120 3 977 65",https://chroniclingamerica.loc.gov/lccn/sn84022960/1908-05-22/ed-1/seq-5/ocr/,annie walker
", proprietors , atlanta , ga.price of small mize , . 91ioolarge maze , - 1 75sold bit all dbuocjimtm.novo ths & tulw3-6 ■ ' r l a ( i qstephen berkv , job and ( gairlxo . a1 ? plum strut.steamers.bostonsteamers ffare $ 1.00.the favorite steamers foreet city and john brooks will alternately leave * ranki.in whakf , portland , at 7 o ’ olock p. m. and india whakf , boston , at 6 o'clock n. m. ( sundays accepted ) .passengers by this fine are reminded that they secure a comfortable night 's rest and avoid tbe * xpenee and inconvenlenoe of arriving in boston lateat night , „ t3f ? tlckets and staterooms for sale at d. h.tocnh 's , 272 middle street.through tickets to new york , via the variousball and sound lines for sale.freigb ' taken aa usual.j . k. < oyle jr. , drncral agent._",https://chroniclingamerica.loc.gov/lccn/sn83016025/1883-03-03/ed-1/seq-4/ocr/,john brooks
"daysthat we have quit reporting them.fact is , mr. editor , ve ca n't keepup with them.faxon , july 8.from greenbrier.regular eorrespondeise.wheat threshing is in progress.m . e. byrn was at paris a fewdays last week.mrs . e. j. byrn is visitiug at bigsandy this week.mrs . ada cherry and robert white are down with the typhoidfever.c . m. mcgill was thrown by araule sunday , receiving painfulbut not serious injuries.jesse herrin , who went to missouri some time ago , has returned , and will move his family out there.there was a large attendance atbaker 's chapel sunday . the protracted meeting will begin at thechapel the fourth sunday in july , ephram herrin and miss idalockhart of the wyly communitywere happily married the first oflast week . we join in extendingbest wishes.miss maud frazier of nashvilleand edgar herrin were married atthe home of justice- g. b. bane ohsunday last .",https://chroniclingamerica.loc.gov/lccn/sn89058013/1902-07-11/ed-1/seq-1/ocr/,robert white
"palmer ; fruit cakefrom mrs. coalter cabell ; large contributions of cake , pickle , & c. , from miss maggie rison ; bread from mrs. thomas v.dudley ; cake from mrs. general anderson ; large contributions of cake and breadfrom mrs. william g. paine ; bread andbutter from mrs. james lyons ; breadfrom mrs. pollard ; cake from mrs. j. a.belvin ; jelly cake from miss s. a. prentiss ; large contributions of cakes , jellies , etc. , to virginia table no . 1 from mrs.william gray ; bread to texas table frommrs . blaukenship ; over one thousandcocoanut balls made and contributed bymrs . alfred harris ; cream and cake bymrs . brander ; daily contributions of fruitcake , salads , bread , etc. , from mrs. josephalleu ; daily contribution of milk frommrs . john llarvey.union bank op richmond . ? the statement of the condition of this",https://chroniclingamerica.loc.gov/lccn/sn84024738/1867-05-08/ed-1/seq-1/ocr/,james lyons
"various duties in aship ’ s rigging required to bedone bv sailors.eight years after the deceaseof his parents jack was calledupon to mourn the death of his isister , and by a strange fatality but three years later thatot his only remainding relative , his brother george . so poor jack graham was bereft of allhe held most dear , and leftalone in the world , the last ofhis family.after receiving the news ofhis brother ’ s death whicli cameto him in a foreign clime , hiswhole character seemed to haveundergone a perfect change , hisformer wonderful activity , inwhich he took so great a prike ■in a great measure desertedhim—hisj heart he said ‘ wasbroke. ’ ■ his thoughts would oftenwander to the former peacefuland happy home of his childhood , and then seated upon hischest in the forecastle , or insome out of the way corner , hewould often beEND CLIPPING | START CLIPPINGor friends to greet youashore . it seemed destinedthat you should fall from aloita second time , and with fatalresults , and that your windingsheet should be beneath theocean over which you had sailed a sailor without an equal , 'poor cripple though you were.many who have not torgotj ten jack graham , may also re1 [ continued on fourth page . ] clothing , great fall stook ofclothing ! .a . . -w , mills .. has just returned fromgig the factories with the largest and119 .best stock ofjll . gent 's clothingever oilered in the norfolk market , whichhe has bought cheap , and designs toastonish the people with the lowprices he intends selling at.the unest stock olclothingever brought to this market can now befound at his store , and the prices are astonishing low.gentlemen are invited to call and examine.a . w. mills , gent ’ s clothier ,",https://chroniclingamerica.loc.gov/lccn/sn85025691/1869-04-22/ed-1/seq-1/ocr/,jack graham
"n . y. , june 30— charles roark , the west shore express robber , was today sentenced to twenty years hardlabor in the auburn prison . roarkleft for auburn this afternoon.lynched.new ori.eaxs , jane 30.— specialfrom simsboro , la. , says that last nighta band of disguised men took james walden . colored , from the custody of aguard who had him in keeping to answerto the charge of larceny , and hangedhim . walden 's character was verybad . he was very daring , and was of avindictive nature.a defaulter.montreal , que. , june 30.—siderable excitement was caused heret-night when it was reported that s. d.j whitney , secretary of the montrealb ard of harbor commissioners , was missing . the chairman of the harborboard . andrew kobertson , stated tonight that whitney is a defaulter to aurge amount.o 'harvard defeated.columbia 's freshmen crew `` wins■ the boat race.new london",https://chroniclingamerica.loc.gov/lccn/sn90059522/1887-07-01/ed-1/seq-7/ocr/,james walden
"< eitrail 1 ‘ acioe , rein raid from verdi wednesday night , w here he went to attend a meeting oftho christian endeavor , says the renogazelle . wo have * no doubt that johnlawrence sullivan was converted on theway in from ogden anil also attended• lie meeting . jack davis lias a hand made buggy athis shop . it was manufactured by himand is substantial and well finished.the bed is of genuine ash put togetherwith screws and the wheels are no . 1soverigii with steel tires . the seatcushions are lined in high grade leatherthe latest patent steel circle is used forthe lifth w heel and the vehicle is fittedw ith sand boxes . it is a fine concordbuggy ami is up for ratile.nobody in washington swmi to thinktliut i lie gentlemen appointed to tlieseniiit ! by tlie governor * of kentucky , florida and oregon liave the remotest [",https://chroniclingamerica.loc.gov/lccn/sn86076126/1897-03-20/ed-1/seq-4/ocr/,jack davis
", er habe das schreiben nach reislicher ueberlegung und in vollständiger uebereinstimmung mit dem präsidenten unterzeichnet.präsident mckinley wird am nächsten mittwoch , falls sich der congreßbis dahin vertagt hat . nach demchamplain - see abreisen , wo er seinesommerferien verbringen will.jeden tag lynchmorde.atlanta , ga. , 22. juli . derneger oscar williams , welcher in derletzten woche die tochter eines weißenfarmers in henry-county zu vergewaltigen versuchte , wurde heute frühzu griffin durch einen mob auf einembahnzuge , auf welch-m er nach atlanta gebracht werden sollte , seinen wächtern entrissen und an der hauptstraßedes ortes , innerhalb 200 aards vondem bahnhose , ausgehängt . die lyncher schössen dem opfer dann nochhunderte von kugeln durch den körper . williams war in barnesvilleeingefangen und zuerst in 's gefängnißzu macon gebracht worden . als dortverlautete , daß ein mob das gefängniß zu stürmen und williams zu lynchen versuchen werde , hielt man es gerathen , ihn",https://chroniclingamerica.loc.gov/lccn/sn83045081/1897-07-23/ed-1/seq-1/ocr/,oscar williams
"the civic federation , read to the committee a letter he bad re ? ceived from andrew carnegie suppos ? ing and criticizing tbe bill.preiident roosevelt 's five foremost privateeitiiao * have accepted his invitation to thehnspitility of ibe white flour . * next month.the- list ia composed of grover cleveland williams denning * brvsn andrew carnegie- , jame * j. hill and john mitchell.sixtieth congress.washington , april ic.bxnatr.the senate wit not in s-ision today.house.an effort wai made in the house ted yto require that the two proposed battle ? ships be constructed by eight hour labor.an amendment to ihe naval appropri ? ation bill to this eftnct was introducedby mr. hughes . it was ruled out ou apoint of order . an appeal from the de ? cision of the chair was taken by thedemocrats , bnt on a party vote , thechair was sustained.with a slubborn parliamentary skir ? mish",https://chroniclingamerica.loc.gov/lccn/sn85025007/1908-04-16/ed-1/seq-2/ocr/,cleveland williams
"were down in apit some thirty-five feet deep , the sides cavedin , completely burying them . a big forceof hands immeiiately set to work to rescuetheir buried comrades , but when reachedjohn wheeler was taken out dead , jamesjones and frank smith were in a dying condition , and william moore , the fourth man , was struck , while unseen , on the head witha pick-ax , and fatally hurt.arms for huytlnew york , nov , 7. the steamer saginaw sailed from this port monday afternoon for san domingo aud other haytianports . after her departure a rumor prevailed that she had on board arms , ammunition aud other goods , and it is understoodthat the huytiau consul at this port mude arequest that the saginaw be overhauled.the revenue cutter chandler was sent downthe bay to arrest the steamer if posdble , butwas too late und returned to her dock",https://chroniclingamerica.loc.gov/lccn/sn87060190/1888-11-07/ed-1/seq-1/ocr/,william moore
", 1892 ; e. frances3'brien , lhft . 't ; nannie boyle , 1898 ; lucysparo , 1894 ; ceclla mober , 1895 ; marxe . kahn , 1895 ; george mccathran , 1895 ; william lyell , 1895 ; clarence keene andherbert carlisle.then there is the colored help ; william robinson . 1805 ; charles lively,1885 ; edward clarke , 1880 , and johnsmith , 1892.the friends ' ceremony , a venerable uncleaf mrs. joseph t. sullivan arose and requestedthe company to keep their placesand witness a second wedding . the bestman , dudley perkins , and the maid ofuonor . miss alice rol ? erts sullivan,3tepped forward , -hand in hand , and repeatedthe friends ' ceremony for themselves.a magistrate was present andscores of witnesses , and the proceedingwas entirely legal . only the immediatefriends of the family had any knowledgejf the proposed , double wedding.mr . and mrs. d'olier",https://chroniclingamerica.loc.gov/lccn/sn83045462/1909-10-24/ed-1/seq-14/ocr/,william robinson
"ld on uniflnl ilonnuitiii notew and dills discounted . exnhingei bought and sold . collections at home or 1y010abroad promptly attended to. , . ? dikectokw . ' john held , christian hem , * j. t. scott , john vockler , bam 1 j. uoyd , ridhard carter . andrew wilson .~ john rf.td.prwt.jobiah f. updeokaff.qtli ' r . my9home insnrance company , or columbus , ohio.capital .... 8300,000.e . p. hubbard , agent , wheeling , w. va : office , no . 85 and 88 , market street nearcorner of qnincy . novh-tfextensive milinery establishment ! no . km walnut street , philadelphi a.madamoiselle keogh , milliner ee paris , having rebuilt and greatlyenlarged her place of btikinem , has nowon hand an entire new assortment of thevery best styles orfrench nillinekt.through her nnmeroas agents in paris , abeis enabled to present inadvanee of other eatabllsemenuithe very laletft fftimrmm",https://chroniclingamerica.loc.gov/lccn/sn84026844/1867-01-01/ed-1/seq-1/ocr/,andrew wilson
"for bitingofficer gooff in tho hand when ho wasarresting her for disorderly conduct . showas fined w for the disorder.a contractor nklps.ciiipaoo , may 8. a timet spccl.il fromtacoina , w t. , says : contractor j. lmccormlck has disappeared with about $ 50,000 secured fiom mends.i'm- assaulting i'olleemuu . james thomas , eomlctcd to-day tor assaulting an officer , was sentenced lu thocriminal court this afternoon to two yearsin the albany penitentiary.r to tli oritud jlirs.charles scott was held for iho grandjury in the police court jesterday forshooting william green some time ago.iicnr ; l ! ' ilnpnrlment station , ati.vms , ga . may 8 , -tho directors.have selected grllfcn . ga. , as tho site fortheslatengilcultuiai experiment station.mom honors lur the uur , london , may 7 . -it is stated that theczar will wlllilu a short time be crownedking of poland . 'morrill 's management of the washingtons",https://chroniclingamerica.loc.gov/lccn/sn82000189/1889-05-08/ed-1/seq-1/ocr/,james thomas
"the driver threatened to smash mvmouth . '' interrupted mr . key . `` unft rtu'iately . '' said the judge , `` that is notcruelty to animals . '' [ laughter . ] the defendant s personal bonds were taken.indictments.the grand jury this morning returned indictments as follows ; john carter , assault withintent to kill joseph brooks . april 16 ; pauli mauv.rd and wt , .ter jwheelcr , larceny fromi liited states : john stewart and ch rl . '- st. w ] art . alms cor.imr.dore stewart , aud jo.- , phsmith . houfehrv.eking iti night incidence of t.f . hazel i. april lti and 17 : mi , li rd saunders '' j lirceii . from person of john williulis . marchj 12 : sadie edmunds , alias evan-. , larceny ofj gold watch and chain lrom john l. lake . jr .. j march 3 '",https://chroniclingamerica.loc.gov/lccn/sn83045462/1889-05-03/ed-1/seq-3/ocr/,john carter
"the purchase money , shall beentitled to take aud hold all the purchasedpi operty , rights , franchises and appances , free from all claim urdfflnandwilmington and reading railroad company , or any oue claiming under them , thereoh or thereto tiy way of equity of redemption or otherwise . george brooks , a. gibbons , geouge richardson.caarles hart , _chapman biddlem . thomas & sons , auctioneers.nos . 139 andlil south fourth street , phll'aje28-28tbwi & furteuo i tu1trusteesof counsel withthe trustees.uspecialbargainsinmillinery , hats and bonnetsrichly trimmed , inladies ' linensuites , inladies linenoverskirts and basques , inladies white basques , 'ininfants ' outfits , inchildren 's dresses , atf . l. frank 's , market street 511511wilmington , del.unkbl 's magic haibre8toberrestores gray-mixed , red , light or fadedheads of hair , beards or moustaches , to abeautiful brown or blank , in from one tofour applications . it is",https://chroniclingamerica.loc.gov/lccn/sn84038119/1876-07-12/ed-1/seq-1/ocr/,george brooks
"new york , to the position of assistant tothe bishop.geo . c. strong has just platted forty acresfcouth of harry street . piatt has been recorded only a few days , yet eight hue residences , mostly two story , are going up already . see his special notice.capt . dick walker returned from mcadocounty last evening , here he had boen intho interest of the rock island . we suspicion that there was a lively old canvass overthere during the late railroad bond contest.yesterday afternoon a team hitched to afarm wagon became frightened at the railroad crossing on east douglas avenue andran down tho streat , leaving a bounteoussupply of potatoes and apples to mark thetrack of the runawav.mr . john exton wants it understood thathe has rented that building of his near thoroyal spice , ns he is anxious to get somesleep in the near future . ho has been",https://chroniclingamerica.loc.gov/lccn/sn85032490/1886-12-04/ed-1/seq-4/ocr/,dick walker
