clippings,url,victim
"2 ? . and will b . `` » among themost interesting events of thelate spring.cltal will be elver in the assemblyhell in ginter perk . following themusicals an informal reception willbe gtven the artists by the club.birthday dinner.a very charming affair of fridaynight was the birthdnv dinner givenby master george gibson in the homeof his parents . mr. and mrs. george gibson , of 302 west franklin street.the table was decorated with m bigbowl of spring flowers , and all sortsof quatnt favors and surprises werearranged at each plat after dinnerthe guests were taken to a “ movieparty . '' ten or twelve guests wereincluded in the invitationaat the woman 's club.dr . h. d. c. maclachlan . of theseventh-street christian church , willbe the speaker at the woman 's clubon monday afternoon at 6 o'clock.mrs . sally nelson robins is chairmanof the afternoon and will present dr.maclachlan , who isEND CLIPPING | START CLIPPINGinteresting events of thelate spring.cltal will be elver in the assemblyhell in ginter perk . following themusicals an informal reception willbe gtven the artists by the club.birthday dinner.a very charming affair of fridaynight was the birthdnv dinner givenby master george gibson in the homeof his parents . mr. and mrs. george gibson , of 302 west franklin street.the table was decorated with m bigbowl of spring flowers , and all sortsof quatnt favors and surprises werearranged at each plat after dinnerthe guests were taken to a “ movieparty . '' ten or twelve guests wereincluded in the invitationaat the woman 's club.dr . h. d. c. maclachlan . of theseventh-street christian church , willbe the speaker at the woman 's clubon monday afternoon at 6 o'clock.mrs . sally nelson robins is chairmanof the afternoon and will present dr.maclachlan , who is a speaker of greatmagnetism and depth.this is the last formal program",https://chroniclingamerica.loc.gov/lccn/sn90052005/1915-05-09/ed-1/seq-5/ocr/,george gibson
"afd he seems6iplagine that in this emergency heaayi resort to the same means which ; overnor ames so effectively used indississippi , which governor kelloggas used and 1r . packard threatens tose in louisiana . and which have-beensed untii they failed in other southrn states . one of senator spehcer'sleputy marshall perrin , shot a holehrough his own hat , cried out , `` kulux ! '' and summoned the united ; tates troops , and when he had thusbtained their aid he proceeded tonake arrests of prominent citizens ando intimidate the dedfocratic voters ofwo large counties . : - in.what way doesovernor cbamberlain 's proclamationiffer , from perrin's- shout of `` kucux ! '' except tht chv'iberlaio'sry is exposed at once , and by eiemers of his owh party.we have several times- urged theolored voters of south carolina toupport general hampton and theenlocratie state and local tickets.ve ' can not 6",https://chroniclingamerica.loc.gov/lccn/sn84026909/1876-10-18/ed-1/seq-2/ocr/,marshall perrin
alexander reed .who performed the final funeral ritesover general grant 's remains.over general grant 's remains . according to the ritual of the g. a. r.—aover general grant 's remains . according to the ritual of the g. a. r.—a simple and impressive ceremony bygeorge g. mead post of philadelphia.the prfiiraiune of the qihi rttes inthe oh equo ' i of general grunt by commvmler ai-k ni1r hed of tthiirreu.llhaite post n . i of philadelphia showsthe great intlu ' in whinlithat on ? nli itloa linn attal 1. it biho shows thatfirst hinl foreman ha consideration andthouffv of tint e runs,https://chroniclingamerica.loc.gov/lccn/sn84028490/1885-09-03/ed-1/seq-6/ocr/,alexander reed
", | , :pulp mill burned.gardiner , me. , feb. ' 18.—the sulphite pulp mill , owned by the richardspat * » r company , in south gardiner , wasburned daring tbe morning . laes , |20u,000 insurance , $ 180 . ( mx ) .tol\ladies'missesand children'sah active worker . john willis uai-r , general secretary of tlmsociety of christian endeavor.the united society of christian endeavor is now considered one of thsgreat institutions of the country , and illgrowth is so rapidthat any statisticswould be obsoletesoon after publication . the trulycatholic spirit inwhich it works , theliberal conditionson which membersare received andthe methods employed to give effect to all deep religious feeling areof course the mainjohnbakr.causes of its rapid growth , but much italso due to the high character and eft * ciency of its officers.none of these haa nutdc a better recordthan its present secretary . john willis baer . toEND CLIPPING | START CLIPPINGconditionson which membersare received andthe methods employed to give effect to all deep religious feeling areof course the mainjohnbakr.causes of its rapid growth , but much italso due to the high character and eft * ciency of its officers.none of these haa nutdc a better recordthan its present secretary . john willis baer . to his shrewd business management is largely due that the united society has been able to pay its way by thesale of supplies , with but little demandupon individual members . mr. baetwits born in rochester , minn. , march 2,1861. and is therefore but 83 years old.he was partially reared in cleveland , but at 18 went back to his native stateand was for some years in the businesioffice of an elevator company , afteiwhich he did newspaper work for tw * years in cedar rapids , ia.ho was among the first in the christian endeavor movement",https://chroniclingamerica.loc.gov/lccn/sn99062034/1893-02-18/ed-1/seq-2/ocr/,john willis
"is the first of the ca3egrowing out of the double lynching of the negro murderers inthat city last july , following1which four indictment3 for murder and seven for unlawful assembly were returned by a special grand jury , which judge ii.c . riley had called to investigate the matter . sam fields and bob coleman , the negroes , were charged withthe murder of william fox , awealthy white farmer , and shortwork was made of the men whenentrance was effected into thejail by the use of a batteringram.the first negro wa3 drawn upto the limb of a tree in the courthouse yard opposite the jail , andthe second negro was takenacross town and and down intothe negro section of the city , and there strung up to a railmad sign post.great interest prevailed during the trial of white and theterminatifn of the case bids fairto have an important bearing onthe cases",https://chroniclingamerica.loc.gov/lccn/sn89066619/1911-04-14/ed-1/seq-1/ocr/,sam fields
"avenue , formerly known ' , hi the bijou cafe . policeman kramer and uurns . were admitted here on paying the requiredtcnty-ti recent fee , and after listening to themelodious strains of a siring orchestra they : v bought a couple , of beers and then arrested ; waiters george wilson and george murphy , : i who served them.j lawyer david kenbcrgcr appeared for the defendants in jefferson market court later in the- - day . after hearing the evidence magistratev brnnn decided to hold all the men , and asked . ' the lawyer if he wanted the examination setdown for to-morrow.t `` i demand an immediate examination . '' said ' lawyer ncwbcrgcr with a show of indignation . ' `` these are legally incorporated clubs and havo ' . v not violated the law . `` 1 `` the court has a great deal of other businessi",https://chroniclingamerica.loc.gov/lccn/sn83030272/1897-05-31/ed-1/seq-2/ocr/,george wilson
"asphaltcompany.the british minister to venezuelahas been in conference lately withpresident castro.mob leader ends life.springfield woman suicides whenplaced under arrest.springfield , 111. , aug. 28.kate howard , leader of the springfield mob , committed suicide when she was informed that she had been indicted bythe grand jury for the murder of scott burton , the aged negro who waslynched at twelfth and madisonstreets on the first night of the riot.itilra . howard was found in her homeby the deputy sheriff , who informedher of the indictment.she asked permission to go into anadjoining room , where she drank poj & < then she walked to the jail'near by and fell dead just inside thedoor.debs to cover many states.chicago , aug. 28.it was announced at headquarters of the socialist party that the campaign special carrying eugene v. debs , thepresidential candidate , and otheispeakers through the west wouldleave chicago aug. 31 , returningsept . 25.",https://chroniclingamerica.loc.gov/lccn/sn86063381/1908-08-28/ed-1/seq-2/ocr/,scott burton
"road tuesday , june 8.nesday june 9 , when a tractor he wasdriving pulled him off and ran overone leg . he was taken to town and itis uncertain whether he will live ornot. ' '' -mrs . ' smith and son charles , weresalem visitors friday . .- : george adams began picking strawberries friday.mr . and mrs. harry b. nerling , thelatter formerly sadie smith , wereguests at the home of the bride'sparents , mr. and mrs. h. a. smith , sunday . ' -mr. sandifer made a trip to salemsaturday.eiecuou uay is nem oy judge skip-worth of the circuit court to be a violation of the corrupt practices act.efreckiefacsun ami win.i i- , rulg u vhow to ileus , , `` p. . 'here 's a chance . m. r '' '5iiau iciiuii t , luai irora jus j to try a remedy for treckown studios . an ideal",https://chroniclingamerica.loc.gov/lccn/sn90066132/1920-06-14/ed-1/seq-2/ocr/,george adams
". 11. ramey 4.00john q. fleming 16.00s . h. gardner 5.00l . k. ilnvctt 23.75j . p. cook 20.00s . k. ridgway 13.50j . t. watson 4.00it . c. steptoe 3.00j . w. riley 0.00sam * 1 michaels 10.00g . f. turner 51.00l . r. 11 u vet t 13.50 thomas johnson 0.00j . w. league 12.00sanrl d. knirlc 4.00win . ny '' . myers 20.00j . m. hcndvicks 7.00win . j. knott- 5.50a . 11. tanquary 20.00john t. colston 24.00robert johnson 57.00p.j . manning ..... 30.80w . l. tablert 10.50hector hell 0.44r . a. alexander . assessor . dist . no.l 50.00clias . 11. trail . assessor . dist . no . 2 50.00t . a. moore , clerk of court .. ' . 25.00sg37.c0a copv ? teste.t . a. mooreiclf.rk of county court.may 27 . 1ss4 . free press and reg . copy.feathers ! _feathers 11i have 500 tbs .",https://chroniclingamerica.loc.gov/lccn/sn84026788/1884-06-03/ed-1/seq-2/ocr/,thomas johnson
"she is the firstrepresentative cf her frx of any colorto be admitted to tliel arof tennessee.she is ihe only colored woman in thef outh licensed to rrrclire law , nnd itis said she is the only colored womanin the united states that isof the bar.memberit has been definitely settled that henry wall , a yountr white man whowas lynched near richmond . va. , foran alleged assault upon sadie cook , was innocent , and there is great indignation against the leaders of the mob.a revised list of the victims of theterrible wreck on the santa fe nearemporia , kan. , on the night of the 8thiplaces the number dead at 12. thej coroner 's jury will meet and try to placeloss to the santa fe railroad will exceed $ 100,000.at huntington . ind. , timothy sulli-van and two other members of his ; household were dangerously poisonedby eatintr fried chicken which",https://chroniclingamerica.loc.gov/lccn/sn94051341/1897-09-18/ed-1/seq-1/ocr/,henry wall
"played after which delicious ices were served.the successful one were miss griggs , miss nellie smith and mr. val yates.those present weremisses messrs.janie edwards val yates -maryjarvia jones henry martinetheldra spessard chas . murpheymary dentisethel jonesnannie w. jonesrita binionmary pattynellie smithmary clyde holtb . swanncalloway kirbyelma pruitf : i c henry lee , hampton williams , john andersonedwin barkingjohn allenarthur murpheywinfield sargentrob pruit , sam harkma , henry pattytom tysontom smootletter from big bud.editor of the dtacon , .j enclose a letter from that distilguished and worthy son of noxubee , judge c. b. ames nsw of oklahoma , that it did no good to receive words ofcommendation from good man likecharley are surely to be appreciatedand am glad that my friend has notfofgotteri me and thought enough of meto stop a moment in his busy life towrite to me . yours , vbig bud.the crops and weather.the continuous performance whic'ithe weather",https://chroniclingamerica.loc.gov/lccn/sn83016943/1912-07-19/ed-1/seq-5/ocr/,henry lee
"with ; universal accord to be not only a triumph of ! art , but a revelation in the history of the past ; that has never had a precedent . our citizens iwill have the opportunity of seeing this grandspectacle iu connection with the manifold other wonders nf the john robinson show , ontuesday , oct . ' j . 'ith.iiwmiibwwwbwwwwwwwb—i » llill:5ick i nney at the , residence ol j. t. gel- jvlii , in opelousas , oct. in , 1892 , herbert civile , : youngest son ol a. e. iinil i , ,ju mckitiuey , a « edtwo years aud ten mouth * .ajj ; ji■ ! : .1|i ! jjji still continueto seil al reduced prices poisspot cash , ( jioods 1 mu siwe need a i silg-o . ( ^im : voi ireapeli and ! si : sl > i : i£s . v : %",https://chroniclingamerica.loc.gov/lccn/sn88064537/1892-10-22/ed-1/seq-1/ocr/,john robinson
"as ev . r.two men blown to atoms.thirty hitt * nf ( « h < nt p « a ilfr exploit * at white < |uuti .htnr , colorado.a terrible explosion of giant powderoccurred in the wierfly tunnel of the whitequail mine , of kokomo , * 'olorndo.william young and john anderson wereblown to n ! om « , and john johnson , john mcleod and will franc terribly injured . manyof their bones were broken by dying ro * k.the accident was caused by the accidentalexplosion of jo sticks of giant powder , and itis a wonder that all the men in the mine werenot killed.a fast of a whole year. % i » iliiiiolft i.msv wakes from nn k « traortcnai y trance.mims tiraceoridloy . residingat amboy , 1lias just awakened hoiu a most remarkableami prolonged tram-c. as t ; > e result of religious excitement she went into a",https://chroniclingamerica.loc.gov/lccn/sn85059533/1891-02-14/ed-1/seq-4/ocr/,john anderson
", illinois , erkrankte die ganze familie des herrnh . w. schmidt , des superintendensten der südlichen illinois-bahn , . nach dem genusse von büchsen-conserven , die wahrscheinlich verdorbenwaren . herr schmidt und seinsohn harry sind bereits gestorbenund frau schmidt liegt hoffnungslos danieder.— jn paris , kentucky , wurdeder neger george carter , welchereine weiße frau zu ver-gewaltigenversucht hatte , von einer bewaffnetenvolksmenge gewaltsam aus demgefängniß geholt und an der courthaus-pforte aufgehängt . an dieleiche wurde ein plakat geheftet , das die worte aufwies : » so wirdes allen negern ergehen , die sich anweißen frauen vergreifen ! « a u s l a n d.— die budget - commission desdeutschen reichstages hat die pensions-vorlage für die china-kriegerabgelehnt in hinblik auf die erklärung des reichskanzlers gras vonbülow , daß eine aufbesserung derjnvalidenbezüge eintreten werde.falls auch der reichstag die vorlage ablehnen sollte , so erwartet man , daß dann die vom grafen bülowangekündigte",https://chroniclingamerica.loc.gov/lccn/sn83045227/1901-02-12/ed-1/seq-2/ocr/,george carter
"> sage you would have to unlearn most or■hat yo » had been taught , we are con-matty showing young actors how to for-uk what they nave been taught in thebnunatlo wtoool * .k '' my first professional engagement was■ a memter of the old baltimore muse■a company , when john owens was■fcnager of that th * « ater . the ptece wasra t'ncls turn 's cann as it la ' wrlttnnp counteract mrs s'owe 's work , whichml then wasting with tremendous sue « ■ . both between covers snd on th * « u » i had only one line , and it wasjws tragedy , ths words being `` faremy mother—farewell , perhaps formrr1 tad studied th§t line long and earn•ttljr , and t fancied 1 could throw a heap » f jsthos tnto it . but my delivery brought « * t a bolstoroua roar from every partsf",https://chroniclingamerica.loc.gov/lccn/sn83045604/1899-03-19/ed-1/seq-15/ocr/,john owens
"ftlhat the papers were preparedyeserday too and that in the afternoonit was decided not to put them in thesheriff 's hands , and molt .to commit forhe so-called contemptsin the superior court here today johnd . groves , a young white man , iwais putenjtrtal the second time for killing henry wall , colored , near wake forest . labor commissioner ham rick hasgone east to get statistics as to fish andtruck . he says that next year he willdonate more space1 sn ithe report tothese industries , as he will have butlittle trouble in securing facts as tomill and mining interests . ib . n. duke , olf durham , makes theoxford orphanage another g'ilft of $ 7,500 , contingent upoh the liaising bythe grand iodg ' e of imasonis of a likesurru his gifts aggregate $ 17,500 . yesterday the grand lodge raised $ 1,600 ofthe desired amount.wakter e. cmcore",https://chroniclingamerica.loc.gov/lccn/sn91068367/1898-01-18/ed-1/seq-2/ocr/,henry wall
"of ! u . s. vs. samuel williams illicit dis- ! idling fined $ 1,000 , six months imprisonment . it . s. vs. john spoon fined $ 150and cost . v. s. vs. w i ) browcr threemouths in prison , fined $ 200 . it . s. vs. john jones fined $ 1,000 , six months imprisonment . . u. s. vs. a ward six months imprimonment , fined $ 1,000 . u. s. vs. henrymegain -fined $ 150 and cost . u. s. vs.hugh woods libel judgment $ 050 andcost . v. s. vs. w ii thomas libel judgment $ 950 and com . l s. vs. larkin lirookslibel judgment $ 500 ami cost.there were twelve submissions , and judgment suspended upon payment of costs.two acquittals ; thin v-fi ve'new bills returned by the grand jury . a large amount ofcivil business disposed of.dogs vs. sheep.official reports show in",https://chroniclingamerica.loc.gov/lccn/sn84020713/1873-05-06/ed-1/seq-2/ocr/,john jones
"and note its wonderfulhealing power . it is prompt andvery effective . price 25r , 50c and $ 1.00 per bottle.sold hy estorge drug co.wanted—5 ladies to trawl withman aud tfife doing interesting demonstrating wot if . experience notnecessary . character references required . apply to j. m. chapman . alma house . : 3 23lost , or ; misplaced.a certificate of deposit , dated december 27tb , 11 * i7| and numbered . '1102 , for $ 400 ; also a cashier 's check , dateddecember 11th , 1017 , being number « 7 , for the sum of $ .100 . the public ishereby warned against negotiatingeither of the above , hut if located theumlersigued should he promptly nolitied.armand a. broussard,4-10 loreauville , la.mr . john trotter is building forhimself and family a home on theeast side , in the lower part of thetown.died—at uip residence of hermother . no",https://chroniclingamerica.loc.gov/lccn/sn88064323/1918-03-23/ed-1/seq-2/ocr/,alma house
"henfoote georgefranklin samguion jimgilmore tomgrahatn henrygraham leegreene samgriflin johnharrison wallaceharrison ikeharrison squireharrison fentonharrison felixhuron williamhlnton saramicks allenhicks roberthicks austholmau henryhopkins mikehopkins allenivv lienrvjackson iteederjackson tomjackson matjackson ' ! 11allen williamanthony i aash johnash georgeatiuore smithhobo westliobo guirehinton samhalbert bentleyilolbrooks alfhopkins .lackhopkins mileshunter joehinton jimbaldwin william jrlrby georgebaldwin cartha iriiy llenrydankhead abe barrett elibaptist johnbeasly owenbeauchamp pavebell w sbell j sbishop gusllovd clifflirackett burneybradford billtlrarifni-d warrenwrshinitou kev webr des .inn kiuara 10111jackson albertjackson spencer.larnttgin rufusjeffries charleyjennings john iijohnson frankjones charleyjones davidjordan .1 imjoiner jimkey georgekey d idmclennon l tmclennon j wmcneill hamptonnance johnnance spotnash jamesf nan hlmnelson wallacenelson pasnelson johnnelson edwardoliver georgeorr wesorr jimpalm robertpalmer jimpatton tompatton jimpatton levipatton frankpatton joepittman grantpeyton matpearson manuelperry israelperry benpoindexter willpope samprice willprice peterprice allenprice louisprimus richardquitman johnrichardson charlesriddle georgerobinson jimrobv simeonroby henry jrroby johnroby tomroby scottroby will , rogers evan ; ross mathewsharp tomsmart johnsmith henrysmith gussmith mosaspann johnstanton warrenstarr harrisonstewart wileystewart georgestewart scottstewart jakestewart esausudberry",https://chroniclingamerica.loc.gov/lccn/sn83016943/1901-03-30/ed-1/seq-1/ocr/,abe barrett
". the financial troubles ofthe country had grown more acute . as wehave said , the republican congress assembledwith sometning like a flourish from theirorgans . the air was to be cleared , a remedy was to be provided , the people were tobe shown that only the party of william chandler and matthew quay could deal inintelligently with the financial crisis . thencunsn was sounaea last ivovemoer , sincewhich the republican majority has hadample t'me to outline , if not to formulate , the policy which it purposes to offer asrerneay , tt lias had ample time to makeclear to- the people die nature of the remedy on which it purposes to go before thecountry.but what has that majority accomplishedwhhasit proposed : ' tt went in withrumblir.gs like those that are smtimej ! heardin the borel ? ) f a volcanic mountain , and , be'noldjl .tb.ia.jujt oflitsjabors was a mousebulainome",https://chroniclingamerica.loc.gov/lccn/sn89066695/1896-01-30/ed-1/seq-4/ocr/,william chandler
men out and strungthem up without ceremony everything is quiet here todayspeedy trial was plannedcharged with the murder of officercargill near marshallmarshall texas april 20 following the killing of deputy sheriff huffman and wounding of constable cargill a few days ago by negroes thegrand jury here today returned indictments charging creole mose pie hilland mat chase with the murder hillchase and mat jefferson are alsocharged with assault to murder highway robbery and using fire armsthree attorneys were appointed todefend each of the prisoners rightof the defendants to be present incourt was waivdd a venire wasdrawn and the cases set for trial monday nexteairdome will be opened to the public monday night next thegilded fool is the billthe management of the airdometake pleasure in announcing that thenew summer theater will open on nextmonday night may 3rd with the truman deroame new york players presenting the gilded fool the playin which maxine elliott and,https://chroniclingamerica.loc.gov/lccn/sn86090383/1909-04-30/ed-1/seq-3/ocr/,creole mose
"woro a llttlo dory , buttheir riders managed thorn well . not afew peoplo in tho procession had huiobouquots and baskets of flowers in tholrbands , tho parado was a very crcdltablooue.thomas muntz acted a chief marshaland was mounted on n splrltod iron-grayhorse lie had as aids jeremiah sullivan , william smith , patrick maharnud charles11 . bransil.tho emmet guards wcro hcadol by thomarino band , captain w. ii . murphy , i'lret lieutenant james ii . kelly , bcomllieutenant p. dillon . tho american nudirish flags waved to tho broozo nbovo thisorganization . tho uniform was : shakos , dark ' green uniforms , ovorcoats . theyrnarchod well and mado a flno appearancethoy wcio tho recipients of marked admiration . thero woro about fifty men inline.rollowlng them camu tho georgetownonthollc hibernian society , james clcincutcommanding , samuel urcnzell marshal , , with patrick gloason and john mcciuu asdeputies . about 7.1",https://chroniclingamerica.loc.gov/lccn/sn82014424/1885-03-17/ed-1/seq-1/ocr/,william smith
"has returned from mongomery where she was the guest < friends.e . s. latimer and mrs. vail of foriland are registered at the hotel albert.g . tv . carter has returned afterpleasant visit to relatives in meridian.mr . and mrs. john f. watkins < faunsdale spent today in selma . arthur stewart , a prominent attorntof marlon , was in the city today.f . f. wise and miss catherine tvlileft this morning for pensacola.william 4f . weaver , a prominent planer of south side , is in the city.dr . a. r. coleman and f. h. colem : left this morning for pensacola.captain p. h. norris has returned froa pleasant visit to hot springs.miss kste bethea of faunsdale la t ! guest of mrs. r. p. lockhart , arthur blalock , a prominent plantersaftord , was in selma today.w . r. wright , a popular traveling miof meridian , is in the",https://chroniclingamerica.loc.gov/lccn/sn84020645/1903-03-06/ed-1/seq-2/ocr/,arthur stewart
"ndngton , 4lyman . 3newfleld , 3north berwick , 3parsnnstleld , 4saco . 1 * 2san ibid , 4shaplcigh , 3south berwick , 5water borough , 3wells , gyork . 5119\\ nole no . of delegates,258m . a. blanchard , portland , ib . smith . saco , i republican george libby , wealbrook , geo . h. knuwlton , allred . district• saml a. holbrook , freeport , loh.n wentworth , kiticry , committee.luther billings . bridgtojl , i.eller from virginia.congressional nomination.culpeper c. h „ va „ june 2,1868.to tile editor of the preaa ithe congressional nominating conventionheld jo this place last wednesday the 27th ultimo , resulted in the choice ot mr. citarleswhittlesey of alexandria , ( editor of the statejournal ) for congress from this ( 7th ) congressional district . the nomination was madeunanimous and was hailed with the moat enthusiastic cheers by the convention . mr.whittlesey addressed",https://chroniclingamerica.loc.gov/lccn/sn83016025/1868-06-08/ed-1/seq-1/ocr/,george libby
