clippings,url,victim
"andmaud fuller of smith center.police court.j . h. mann was arrested upon a complaintsworn out by j. e. beeman charging himwith assault and battery . the case wastried in the forenoon , the defendant foundguilty and assessed a fine of $ 5 and costswhich he paid.three `` vagrants , '' joe burns , bell stubbins and j. w. freemhaum paid $ 32 each.frank burnett was a drunk that was committed in default of money with which topay his fine . john clark left his team unhitched and was accordingly arreeted.the suit against sheriff hays for sustaining a nuisance was dismissed , it being proventhat the sheriff was powerless to remedy theill . there was no doubt , it appeared in evidence , about the wretched condition of thejail , the poor sewerage , the want ot spaceand a thousand other things that contributeto make this a place of misery . but thesheriff",https://chroniclingamerica.loc.gov/lccn/sn85032490/1887-08-21/ed-1/seq-4/ocr/,joe burns
"the skin , does not clog the pores or growhair.as a general toilet cream for indoor or outdoor use , daytime orevening , riding , driving or traveling . as a base for powder anda natural skin cleaner . 25c perjar . .phone 66e . r. emmelpure fjru6 dispensermrs . george baker and daughter , miss alva , of thornton are guests of j.mr . ana iuru . j. a. jtuic.mrs . r. h. droemer arrived fromrockdale today to visit at the homeof t. b. smith of rellence.mrs . t. m. warburton and childrenwent to gause toaay , where they willvisit mr. and mrs. j. f. williamson.prof . j. j. rogers of allen academyleft today to vist in camero beforegoing to his borne in indiana for thesummer.mr . and mrs. r. r. mcanelly andmrs . a. p. coleman went to waco today , where they will spend a fewmonths previous to locating",https://chroniclingamerica.loc.gov/lccn/sn86088651/1913-06-04/ed-1/seq-5/ocr/,george baker
nightabout 9 oclock the large steam laundrybelonging to the park hotel companywas burned to the ground the loss isheavy but is said to have been insuredfor a considerable amounta manly teeechange tex aug 13 a mob of atleast five hundred armed men overpowered the guard this morning and took thenegro jim brooks who was arrestedyesterday on a charge of rape andhanged him to a tree this tree has arecord for similar service it having beenutilized no less than three times in tholast ten years charles bernard anegro barber of this place was arrestpdon information given by brooks and isheld as an escaped convict from tholouisiana penitentiary our sheriff hascommunicated the facts to the louisianaauthoritiesbis sandyspecial to the gazettebig sandy tex > aug 13 j elowery a merchant of this place recently had a well dug on his premisesand after reaching a depth of twentyfive feet he struck a fine stream of mineral,https://chroniclingamerica.loc.gov/lccn/sn86064205/1889-08-14/ed-1/seq-8/ocr/,jim brooks
"the denver star has the largest circulation among the colored people . get wise and advertise.the papers formerly known as the statesman and the independent , have been merged into the denver startwenty-sixth year number 32interesting newsconcerning the race.hang a woman.muskogee , okla. march 31 . — marie scott , a negro woman , who sunday night killed lemuel peace , a young whiteman by driving a knife intohis heart , was taken out of thewagoner county jail early today and hanged to a telephone pole . the mob . whichwas masked , over-powered thejailor , a one-armed man , threwa rope over the woman ’ s headand dragged her out of thejail.democrats attack stewartwashington , d- c. , march24th charging that he hadbeen too friendly to the negro railway mail clerks underhim and that in addition he isa holdover republican , representatives webb and page ofnorth carolina called",https://chroniclingamerica.loc.gov/lccn/sn84025887/1914-04-04/ed-1/seq-1/ocr/,marie scott
"brotherhood of locomotive firemen becauseof increased size of trains and engines.at the opening of the fall term of theuniversity of chicago over 2,400 students were present.the chicago-new york auto tour isfinished , and is the most remarkablelong distance run in america , 1,137miles being covered in 76 hours.a mob lynched walter davis ( colored ) at marshall , tex. , for the murderof constable hayes.the public debt statement issued onthe ist shows that the debt decreased $ 6,171,812 during the month of september . cash in the treasury , $ 389 , -417,184 . total debt , less cash in treasury , $ 917,752,545 , willis , frederick m. and burton vanwormer ( brothers ) were put to deathin 15^ minutes in the electric chairat the prison in dannemora , n. y. , for the murder of their uncle , peter a.hallenbeck , at greendale , on christmas eve , 1901.mayor seth",https://chroniclingamerica.loc.gov/lccn/sn91059411/1903-10-09/ed-1/seq-7/ocr/,walter davis
".- ... ' - ; . ; joggles— just now i shouid judge he wasleading a saloon movement .. ' . : ■ ? £ '' ? * ; the match trust seems to have sympathetically collapsed with the bursting of thealger boom . : down in `` egypt '' bill morrison 's ' presidential boom is wading around ; in ' goloshes , and if the present weather continues it willneed a life preserver . .if 'everyday business transactions .wereconducted according to the principles- ofblame 's and salisbury 's `` diplomacy a majority of our merchant princes would soon'be in the poor house . `` .. 7.7.the attention of senator hill is earnestlydirected to the fact that the force bill is dead , while bland 's silver atrocity , is an exceedingly lively issue . better quit thumping thecorpse and joust with the live enemy . .people who have been anxiously",https://chroniclingamerica.loc.gov/lccn/sn90059522/1892-03-18/ed-1/seq-5/ocr/,bill morrison
"and relief is obtained at oncedr . john bull-i have no hesitation in saylnpthat i believe your sarsaparilla to be the besimedicine manufactured for the cure of scrofulabypbllls . and many other cutaneous and glandular affections , havinir used it with , entire successin numbers of ibo above cases . james moore , louisville , ky.tb . jomf bull . i procured one bottle ofbull 's sarsaparilla for my eldest son . amopkthe remedies and various prescriptions that uebaa tried for weak lungs and chest , this one bottkhas been of more benefit to him than all . it ha , cure.a me of dyspepsia as well.jollii 8 , mcqee , horse cve , k , scrofulais a peculiar morbid condition ofilifewe system , caused airecvy oyimpurities in the blood or bythe lack of sufficent nourishment furnished : to the system through the blood , usuallyaffecting the alanda . often resulting inswellings",https://chroniclingamerica.loc.gov/lccn/sn86088296/1887-04-21/ed-1/seq-6/ocr/,james moore
", ga. ; iconise anddora pfeiffer , leola and nannie berry , miss broughton . miss carriegahlenbock . mrs. g. c. hallmark . etta muller , pearl librand and xinasmith , also messrs. wm . gahlenbeck , alfred gahlenbeck , frank williams , fred williams , g. c. hallmark , tom johnson , g. suarez , l. a. pfeiffer , mr.gilbert , mr. cole . henry hartman , chas . and edwin pohlmann.music at thegadsdenstreet church.miss herring , who is here from birmlneham . the guest of mr. and mrs.r . e. i , . cresap . will sing `` i 'm a pilgrim '' at the gadsden street m. e.church this morning . she is the possessor of a voice of wonderful powerand sweetness and has chosen a delightful selection.the civic league willmeet wednesday.the regular meeting of the civicleague will take place on wednesdayafternoon at 3:30 o'clock . all members should",https://chroniclingamerica.loc.gov/lccn/sn87062268/1910-02-06/ed-1/seq-13/ocr/,tom johnson
"alsothe myers agency.there seems to be quite an immlgra-number of families having comewithin the past two years.the following is a partial list of newschool directors elected monday : mcartbur township district no . 1 , john r. miller ; 2 , ed kerr ; 6 , noquorum ; 7 , frank howard ; 9 , jamessayler ; 4 , robert wheeler ; ft , c. d.buckwalter.pleasant township creglow , ( 'has.nichols.richland township no . 1 , jakefry , re-elected ; 2 , ed bridge.waehington township no . 4 , johnr . miller ; 6. solomon coover ; 1 , samuel kayler ; 6 , al johnson.bloom qeld township no . 1 , e. p.hanks.w . e. o. has sold dolly whack to mo-graw parties . `` whack '' now roams atease where living waters flow.rev . duncan , of scotch ridge , o. , will preach for the u. p. congregationnext sunday.but",https://chroniclingamerica.loc.gov/lccn/sn85038153/1902-04-22/ed-1/seq-2/ocr/,frank howard
"» us , why do n't youmake up to the little girl ? go inand win , man ! 'pon my life , she 's aregular pearl . `` gus ( sulkily ) —that may be but ica n't get along with the mother ofpearl.^ one_the glories of free trade.sir edward sullivan , an eminentenglishman , asserts that `` since 187üthe value of lands and the incomefrom farms have fallen from 30 to 5 ( 1percent , but the interest on themortgage remains the same . '' ilequotes lord derby as stating thatthe losses of english landownershave been £300,0 < .mj,000 ( equal to * 1,459,800,000 in united statesmoney ) , and he estimates the lossesof tenants at * ( 500,000,000. hundreds of thousands of acres haveout of cultivation within 10years . all this in a glorious freetrade country ! montana'sgame lawspoints to be observed by sportsmennn ho are not- looking fortrouble.out",https://chroniclingamerica.loc.gov/lccn/sn85053323/1894-05-12/ed-1/seq-1/ocr/,edward sullivan
"28 01 28 01john harrington , clothing 43 50 43 50estelle reel , salaryand expanses su-perintendent ofschool * * 77 00 77 00the following claims for bounty onanimals were allowed ; d. parker $ 8 00h . z. yoder 2 00w . l. jones 3 00thos . freel 16 00 wm akerson 58 00a f. whitman 2 00d . james 3 00geo . d. johnston 5 00a f. krohn 17 00e . peterson 4 00wm . myers , sup-plies $ 6 30 $ 6 30j . m. culver , rebatetaxes 12 00 12 00o . f. rhoads , re-pairs court hous . 300 300union mercantilecompany.supplies 47 85 47 85city gas company , gas court house .. 26 50 26 50ed f. stable , salaryassessor 126 55 126 55the leader , blankbooks 34 00 34 00jesse gregory , wit-ness justice court . 450j . l. jordan , wit-ness justice court . 12 90h",https://chroniclingamerica.loc.gov/lccn/sn86072173/1894-01-09/ed-1/seq-1/ocr/,wm akerson
"alfreda ahrens , ellen bomnn , hannah grccndole . ottlcamagnuson , ebba kugge , elna kugge , axel kvarnstrom , john boman , davidmagnuson , axel bjorkland , carl bunth , ivan hector , john hedman , oscaremanuelson , enoch magnuson , edwinbolln , john johnson , john anderson , alfred johnson , andrew boman , fraryanderson , ernest johnson , manfrledemanuelson , frank nord , gustaf hertz-berg.episode 11. review of pageant.england , mrs. j. harry estey ; newengland , mrs. levi k. fuller , mrs.julius j. estey , mrs. n. i. hawley , mrs.george s. dowley , mrs. george w.hooker , mrs. w. h. blgelow.the makers of tomorrow children ofthe primary nnd grammar schools.j . sutherland & co.brooks house blockbrattleboro , vermontthe committee for the pageant areas follows : executive dr. henry d. holton , majorc . houghton , w. a. shumway , c. l.stlekney , mrs. l. f. adams ,",https://chroniclingamerica.loc.gov/lccn/sn98060050/1912-05-17/ed-1/seq-3/ocr/,alfred johnson
"wilcox , the parents whogave nway the bride ; pet graves , theofficiating clergyman ; nello steele andbob hyer , the bride and groom ; blanchecarothers . the maid of honor , who carriedthe cushion bearing the ring ; attendantsjamie kerr and lucille chapman , jimdimmitt and mabel kooritz . james daniel s anu mab casey , m. e. steele andjuan teaie.refreshments were served down stairs.the entertainment , which was gotten tipby the indies of the episcopal church.was as unquaiined success and netted $ i0 towards a most worthy cause , a newphnrcn organ.the review club met on wednesday nthe elegant home of mrs. h. w. harrel.one of its members and the club 's firstpresident . in their study of french history the club has finished a critical review of the reieh of henry i. and before passing entirely from the sixteenthcentury it was wisely determined to giveone afternoon to the study",https://chroniclingamerica.loc.gov/lccn/sn86088296/1897-11-25/ed-1/seq-3/ocr/,james daniel
"and killed conductor james lemou , at baker ’ s station , and escaped . thelouisville & nashville railroad company has offered a largo reward for hisapprehension.a doubln lynching : .a lilug u1 w jli -- , , _ — vw.vjthe jail at morganton , n. c. , took out franklin stack , a white man , and davidboone , a negro , and hanged them . stackambushed robert parker , a student atcollege , who killed stack ’ s brother , andboone shot and killed a man at a campmeeting . the people of morganton propose to ferret out the lynchers and punishthem.an old lady missing.mrs . sadler , nearly iseventy years ofige , mother of mr. david sadler , a planter residing on the big black river , nearhawkinson ’ s ferry , ’ warreu county , miss. , mysteriously disappeared recently . her family thought she had gone tovisit",https://chroniclingamerica.loc.gov/lccn/sn84020151/1889-09-21/ed-1/seq-1/ocr/,franklin stack
"hardening process it will be examined with aview to determining whether it showsmark ? of pressure . cunninjjhani 's lawyerclaimed at hie trial that he was insaneas the result of an injury to the head , and the object of the present examinationis to determine whether such was thecase . sam hose 's son.say * hit father , though burned atthe stake , was innocent.washington , may 4.—john hose , aged nineteen , son of sam hose , who wasburned at the stake et nev.nan . ga. , tendays ago , was today furnished transportation to philadelphia by the district officials . he says hts mother has gonathere and asserts his father 's innocence.dr . coleaad council of physicians ; cures all diseases of men.uu v iliutfihtitk . hour pimples on■ufa i : ^|^ « pjw ' . efmg your f « c « andi * * - ! . l. colkEND CLIPPING | START CLIPPINGwas insaneas the result of an injury to the head , and the object of the present examinationis to determine whether such was thecase . sam hose 's son.say * hit father , though burned atthe stake , was innocent.washington , may 4.—john hose , aged nineteen , son of sam hose , who wasburned at the stake et nev.nan . ga. , tendays ago , was today furnished transportation to philadelphia by the district officials . he says hts mother has gonathere and asserts his father 's innocence.dr . coleaad council of physicians ; cures all diseases of men.uu v iliutfihtitk . hour pimples on■ufa i : ^|^ « pjw ' . efmg your f « c « andi * * - ! . l. colk . by letterconsultation proa dr- alfred l. cole anduonsuiiatiun rravi council of pb } » iciau « ,24 washington ay . south , minueapolii .",https://chroniclingamerica.loc.gov/lccn/sn90059523/1899-05-05/ed-1/seq-7/ocr/,sam hose
", 809 e. sixth ave.frank barnett . 322 harrison st.c . f. atwood . 312 e. eighth st.nathaniel rice . 523 harrison st.mrs . e. colvin . 915 n. van buren.misn blanche everett , 710 monroe.joseph weinkauf , u. p. tel . office.wm . whittington . 318 w. 5th.mrs . frank bates . 211 e. 10th.frouie armstrong , general delivery.rudolph petereck , 424 buchanan.miss eunice rugger , 1135 n. quincy.florence davis , santa fe hospital.mildred creamer . 132 monroe.miss pauline mcvey , 626 buchanan.mrs . c. m. reuugh . oakland.mrs . w. bauer . 1206 jackson.mrs . e. a. schuster , 722 chestnut.mrs . c. j. king . 906 madison.mrs . rosa poleneck . 1310 e. crane.arthur sipes . 822 n. jackson.mrs . d. r. ganiard . 1115 jackson.myrtle f. howard . 320 topeka ave.ohas . peary . 201 harrison.miss gladys jackson . 714 chestnut.harry drake , 1221 n. van buren.hulda zimmerman",https://chroniclingamerica.loc.gov/lccn/sn82016014/1910-03-12/ed-1/seq-8/ocr/,frank bates
"& moffetts drug stfre.mankato , minnesota.john a. willard . president.8 . lamm . vice-president , geo . h. clark , cashier , l . a. linder , ass't cashierfirst national bank , collections invariably remitted .onday of payment.j . a. willard , stepaen lamm , it . d hubbard . henry foster , john klein , geo p. hokrr , m . g willard.pw-s.-ii our t ' * n drafts on all parts of europe and passage tickets to and from allparts of europejohn f. meagher . president.w . g. hoerr , cashier.citizens ’ national bank , capithldirbctohs : john f mbaohbh . n. wbib.lbstbh pattbhbon . wm . thomasv . h. kbli.y . j . 8. hinorlby.collections made on all accessible points tnunited states.highest market price paid for gold , silverand united states bonds.sight drafts on all parts of europe.passage tickets to and from europe.mankato national bank , capital , sioo",https://chroniclingamerica.loc.gov/lccn/sn83016589/1888-07-20/ed-1/seq-1/ocr/,henry foster
"south is destined to supply the country and agood part of the world , not wilbraw cotton , but cotton goods ofevery variety , '' — [ n.j o . democrat.llmostllncredible . [ globe-ljemocrat . ] little hock , ark . `` , sep. 16.—information was received hereto night that jane campbell , acolored woman , living neardyke 's mill , la „ killed two ofher children , aged respectivelyten and twelve . the womanbeat out£theii brains with a pineknot for some trivial act of disobediene « . after the inquest ardwhen the cause of the death became generally known , a mob ofwhites and blacks dragged mrscampbell from her cabin , tiedher to a stake , aud despite hercteams , literally roasted heralive . the crime and punishment are without parallel incriminal auuals . `` tell me what it is , darling , he said , reassuringly , taking herhand ,",https://chroniclingamerica.loc.gov/lccn/sn86053659/1881-09-30/ed-1/seq-1/ocr/,jane campbell
"designs in advertising cutsat the daily express office.—clothing , clothing , clothing for thepeople at wheelock ft oliver ’ s.—cuts to tit ad . made * on shortnotice at the daily express office , —metropolitan clothing house—wheelock ft oliver.—h . ft h. for cleaning carpets , woolens and silks . frank smith ’ spharmacy.—new rrocess stove a anu regular prise * 22 and * 24. brewster , jones & co.—ton need it in your business—anoriginal cut . get it at the daily express office . ' —attention horsemen ! call at burks „ * co ’ s and see the one-tpare drivingwagon , she is a beauty.—there will be a sale of eatables atthe congregational church parlors saturday from 4 to 5:30 p. m.—lawn hose , refrigerators , creamta freezers , , lawn mowers , etc. , in largevariety at brewster , jones & co.—b . f. leidy ’ s residence ,",https://chroniclingamerica.loc.gov/lccn/sn84020107/1893-05-25/ed-1/seq-4/ocr/,frank smith
"inthose of the war of sections ; in the raising up of paul jones and perry , of prebleni ‘ d hull , when , discouraged upon the land , theea was to send god 's people messages of vlct '' ! v. and in the striking down of albert sidney johnson and stonewall jackson , when theyw * re sweeping all before them . inscrutablean * the ways of providence to mam . philosoph « rs may argue as they will , and . rationalismmay draw its conclusions ; but the mysteriousp twer unexplained by either has , from the beginning of time , ruled the destinies of men.hack of these foroes of life and thought therei * y t another force equally inspired of god and•■quail v essential to the exaltation of man.a forcewithout which the world does not move except ‘ lourward , the force of the imagination whichi",https://chroniclingamerica.loc.gov/lccn/sn86074063/1898-08-17/ed-1/seq-3/ocr/,sidney johnson
"street '' heintz , 57 varieties . `` rfortho small advertiser thereis nothing like the exchangecolumns of the evening journal , which are read in the homesthroughout wilmington and itsadjoining territory.jinegro lucmo 8 ) hlgbolsbrutally l < led two inoffensive merwith an axe.shreveport . la. , nov. 8 . — joseph craddock , a negro , was lynched by atinfuriated mob . ccrnposod chiefly ctaylor , « town . craddoc'blacks , atkilled two inoffensive colored men ar 1fatally injured a mother . he approached the home of wesley chambers , f.aegi ' o cotton picker , and called himafter wlklzpcrlng to him . end c .3out.chambers turned to leave , craddoc'split his bead with an axe . craddock * « » 1 v'uu n viît l'^man frightfully . .i « 4 then uilloa dr.iwashington , nnc thor negro , and frightmonter chambers , afully injuredbrethor of wesley , t'raddock boastedblg c-imra and",https://chroniclingamerica.loc.gov/lccn/sn85042354/1903-11-03/ed-1/seq-6/ocr/,joseph craddock
"all principalpoints . pullman aleepei h en nic.li ? tralr a.train no . 2 leaves colombia daily , sun.days excepted . express no . 4 every night.jab . anderson , orneral sup.a . tor-k. gen. passenger and ticket agcn ic ? n ? ? ree iron w0bk8columbia . b. c. john alexander , proprietor.^^^^|^^^^^^and dwellings , patent palling * tor gardfpsand cemeteries , iron settees ard 4ayr > nrchaira ; also . brass castings or ml ) kinrls , bells for , churoucs , schools ) work-shops , ac . guarantee all my work in hi c.'iua ardoqnal to shy north or poutn.works at foot ol lidystreet and rear toreuth carolina and greonvllw a columbiarailroad companies ' depots . nov 18 xml|txt",https://chroniclingamerica.loc.gov/lccn/sn84027008/1875-02-16/ed-1/seq-6/ocr/,john alexander
"parker , and his place ofresidence ss washington city . the justice gave him a preliminary hefting , andat its conclusion committed him to jailin default of $ 1,000 bail to inaure hisappearaooe at court . parker ia a youngfellow of seventeen or eighteen years , andis a son of henry parker , a former res * ident of this city , bat now living inwashington city . nothing of any valuewaa found on young parkers person , andif he secared any booty he threw it awaybefore being arrested.pibsonal poiirra. ? gov . mathews returned yesterday from the white sulphur springs.mr . james cunningham , jr. , a clerk inone of the departments at washington , ishome on ashort furlough.misses alice v. and ella b. oxlobyhave returned from a visit of severalweeks to their brother , mr. wm . h. oxtobv , at erie , pa.wm . erskine , esq. , is",https://chroniclingamerica.loc.gov/lccn/sn84026844/1878-08-20/ed-1/seq-4/ocr/,henry parker
"horse , one mule and five head of cattle . leviedon as the property of margaret m. mcgrewat the suit of wade hnmptou.alsoat fort motte on tuesday tho 8th day ofseptember . one lot of machinery for mill.levied on as the property of john a. mckenze at the isuit of john alexander .sheritrs office , ) e. i. cain , orangcburg c. h. s. c , [ s. o. c.aug . 10th , 1874. jnug 21 3tfor ( he legislature.mr . juli tot * : ? please announce judge b.g . fredick , of the fork , n candidate forthe legislature at ( ho coming election andoblige.many friends.l ff1 ? k ? i ? co. , auditor.july . idfii ; 1874.to mrs. e. m. jackson : take notice , that mrs. e. a. buarl haspaid into ila ? count ) - treasury ( ho tax.costs an i penalties < .n the bind",https://chroniclingamerica.loc.gov/lccn/sn84026920/1874-09-05/ed-1/seq-3/ocr/,john alexander
"; and miss kate j. bacon , arrivedin the city from champaigne yesterdav.they are regi.-tered at the m. charles.i hereby warn all saloon keepers torefrain from selling my wife , alicesmith , liquor or other intoxicating drink.all who disregard this notice will beprosecuted to the lull extent ot tho law.3t- anthony smith .miss alice and master sam . hallldayleft yesterday on the 2:30 p. m. train onthe illinois central railroad for an extended visit north , intending to stop amonth or so at sheboygan . we wishthem a sate and pleasant journey.canine it whitlock are recoenlzed asstanding at the head of the dental protessiou ol southern illinois . theirrooms are over black 's store , on commercial avenue . give them a call whenyou have anything in their line you wantdone . aug 13 2wsquire corning ' , it is said will makea canvassing tour through the countywithin a few days ,",https://chroniclingamerica.loc.gov/lccn/sn85033413/1877-08-24/ed-1/seq-3/ocr/,anthony smith
"concerts will t , have the pleasure of hearing the saint- nsaens concerto played by miss hope edna a ] hopkins at the concert next tuesday even- tng . this composition was on the program jof the markh concert , but miss hopkins owas too ill to appear . 110 william campbell , colored , seventeen vyears old . was taken to the emergencyhospital .1 out s:34 o'cloek this morning psuffering from a frak ture of the right leg tbetween the hip and knee . the boy lives sat 742 i2 : street southeast . ile was driv- aing over the crossing at 1st and canal 11streets wbn his wagon was struck by an 1anacostia car . a ith the result stated.tyou will . find what you want at tprices 0less than you think . and we like to show iour stock . jas . f. oyster , im0 pa. ave. ,",https://chroniclingamerica.loc.gov/lccn/sn83045462/1901-04-13/ed-1/seq-16/ocr/,william campbell
"hepiuaueu not guilty , the novgorod province has decided topetition me kussian government for aloan of $ 5,125,000 to provide the sufferingpeasants with breadstuffs.mrs . eliza halzer , a widow , and hor in.tie daughter were killed while crossing thei juuuiiuio iracks at uue hundred audnineteenth street , chicago.mrs . james caruso , wife of one of thenew orleans riot victims , attemptedsuicide by taking laudanum . she said herhusband called her aud she must obey.execution has been issued against thecobb vulcanite wire company , of wilmington , del. , for $ 100,000 , at the instanceof william wrightman , of philadelphia.president gompers decides that organizer gruelle was too fresh in expellingthe indianapolis street car strikers fromthe federation of labor , and takes themback.icbanon ( ind . ) baptists are fightingover possession of a meeting house , and , withdrawing to go to court , might veryproperly call themselves the se-cedarsoflebanon.the body",https://chroniclingamerica.loc.gov/lccn/sn88061072/1891-07-20/ed-1/seq-1/ocr/,james caruso
